{
  "$schema": "../schema.json",
  "title": "QRScout",
  "page_title": "Crescendo",
  "year": "2024",
  "sections": [
    {
      "name": "Prematch",
      "fields": [
        {
          "title": "Scouter Initials",
          "type": "text",
          "required": true,
          "preserveDataOnReset": true,
          "code": "scouter"
        },
        {
          "title": "Match Number",
          "type": "number",
          "required": true,
          "code": "matchNumber",
          "preserveDataOnReset": true,
          "autoIncrementOnReset": true
        },
        {
          "title": "Robot",
          "type": "select",
          "required": true,
          "code": "robot",
          "choices": {
            "R1": "Red 1",
            "R2": "Red 2",
            "R3": "Red 3",
            "B1": "Blue 1",
            "B2": "Blue 2",
            "B3": "Blue 3"
          },
          "defaultValue": "R1"
        },
        {
          "title": "Team Number",
          "type": "number",
          "required": true,
          "code": "teamNumber",
          "preserveDataOnReset": false
        }
      ]
    },
    {
      "name": "Autonomous",
      "preserveDataOnReset": false,
      "fields": [
        {
          "title": "Mobility Point?",
          "type": "boolean",
          "defaultValue": false,
          "required": false,
          "code": "Mved"
        },
        {
          "code": "note#InSpeaker",
          "title": "Notes Scored in Speaker",
          "type": "counter",
          "defaultValue": 0,
          "min": 0,
          "required": false
        },
        {
          "code": "note#InAmp",
          "title": "Notes Scored in Amp",
          "type": "counter",
          "defaultValue": 0,
          "min": 0,
          "required": false
        }
      ]
    },
    {
      "name": "Teleop",
      "preserveDataOnReset": false,
      "fields": [
        {
          "code": "tspeaker",
          "title": "Notes Scored in Speaker",
          "type": "counter",
          "defaultValue": 0,
          "min": 0,
          "required": false
        },
        {
          "code": "tamp",
          "title": "Notes Scored in Amp",
          "type": "counter",
          "defaultValue": 0,
          "min": 0,
          "required": false
        },
        {
          "code": "ttrap",
          "title": "Notes Scored in Trap",
          "type": "counter",
          "defaultValue": 0,
          "min": 0,
          "required": false
        },
        {
          "code": "Robot Disabled?",
          "title": "Teleop Foul",
          "type": "boolean",
          "defaultValue": false,
          "required": false
        }
      ]
    },
    {
      "name": "Endgame",
      "preserveDataOnReset": false,
      "fields": [
        {
          "title": "Climb?",
          "type": "boolean",
          "required": false,
          "code": "bclimb",
          "defaultValue": false
        },
        {
          "title": "Park?",
          "type": "boolean",
          "required": false,
          "code": "bpark",
          "defaultValue": false
        },
        {
          "title": "Harmonized?",
          "type": "boolean",
          "required": false,
          "code": "harm",
          "defaultValue": false
        },
        {
          "title": "Scored in Trap in Endgame?",
          "type": "boolean",
          "required": false,
          "code": "trap",
          "defaultValue": false
        }
      ]
    },
    {
      "name": "Postmatch",
      "preserveDataOnReset": false,
      "fields": [
        {
          "code": "under",
          "title": "Cycled Under the Stage?",
          "type": "boolean",
          "defaultValue": false,
          "required": false
        },
        {
          "code": "co",
          "title": "Comments",
          "type": "text",
          "min": 0,
          "max": 50,
          "required": true
        }
      ]
    }
  ]
}
